<?xml version="1.0" encoding="ISO-8859-1" ?>

<!DOCTYPE search-metadata PUBLIC 
"-//Maisis//DTD Search MetaData 1.5//EN" 
"http://www.maisis.pt/search/dtds/search-metadata_1_5.dtd">

<search-metadata>
  <name>search3</name>
  <label>Exemplo ajax</label>
  <description>...</description>
  <table-source>UTILIZADOR_VIEW</table-source>
  
  <!-- search params -->
  <search-params>
    <search-param>
      <name>nome</name>
      <field>upper(NOME)</field>
      <operator>LIKE</operator>
      <container>
        <label>Nome</label>
        <type>text</type>
        <size>160</size>
        <input-size>50</input-size>
        <ajax>
          <sql>
            <statement>select nome, nome from utilizador_view where nome like ?</statement>
          </sql>
          <source>nome</source>
          <parameters>
            <parameter>nome</parameter>
          </parameters>
        </ajax>
        <validation>
          <converter>sqllike</converter>
        </validation>
      </container>
    </search-param>
    
    <search-param>
      <name>numero</name>
      <field>NUM_EMPREGADO</field>
      <operator>IN</operator>
      <container>
        <label>Num</label>
        <type>text</type>
        <size>160</size>
        <input-size>50</input-size>
        <validation>
          <converter>split</converter>
        </validation>
      </container>
    </search-param>
    
    <search-param>
      <name>tipoUtilizador</name>
      <field>ID_TIPO_UTILIZADOR</field>
      <operator>=</operator>
      <container>
        <label>Tipo</label>
        <type>select</type>
        <size>95</size>
        <default-value-list>
          <sql>
            <statement>select id, nome from tipo_utilizador</statement>
          </sql>
        </default-value-list>
      </container>
    </search-param>
    
    <search-param>
      <name>nomeUtilizador</name>
      <field>NOME</field>
      <operator>LIKE</operator>
      <container>
        <label>Utilizador</label>
        <type>select</type>
        <size>95</size>
        <ajax>
          <sql>
            <statement>select nome, nome as label from utilizador_view where id_tipo_utilizador in (#)</statement>
          </sql>
          <source>tipoUtilizador</source>
          <parameters>
            <parameter>tipoUtilizador_multipleResult_hidden</parameter>
         </parameters>
       </ajax>
      </container>
    </search-param>
 
    <search-param>
      <name>data</name>
      <field>DATA</field>
      <operator>=</operator>
      
      <composite-container>
        <label>Data</label>
        <validation>
          <converter>sqldate</converter>
          <converter-properties>
            <property>
              <name>default-pattern</name>
              <value>yyMMdd</value>
            </property>
          </converter-properties>
        </validation>
        <formatter>
          <name>message</name>
          <pattern>{0}{1}{2}</pattern>
        </formatter>
        
        <fragment-container>
          <name>ano</name>
          <label>Ano</label>
          <type>select</type>
          <size>45</size>
          <input-size>4</input-size>
          <default-value-list>
            <constants>
              <constant>
                <key>07</key>
              </constant>
              <constant>
                <key>06</key>
              </constant>
              <constant>
                <key>05</key>
              </constant>
              <constant>
                <key>04</key>
              </constant>
              <constant>
                <key>03</key>
              </constant>
              <constant>
                <key>02</key>
              </constant>
              <constant>
                <key>01</key>
              </constant>
              <constant>
                <key>99</key>
              </constant>
              <constant>
                <key>98</key>
              </constant>
              <constant>
                <key>97</key>
              </constant>
              <constant>
                <key>96</key>
              </constant>
              <constant>
                <key>95</key>
              </constant>
              <constant>
                <key>94</key>
              </constant>
            </constants>
          </default-value-list>
          <validation>
            <converter>date</converter>
            <converter-properties>
              <property>
                <name>default-pattern</name>
                <value>yy</value>
              </property>
            </converter-properties>
          </validation>
        </fragment-container>
        
        <fragment-container>
          <name>mes</name>
          <label>Mês</label>
          <type>text</type>
          <size>25</size>
          <input-size>2</input-size>
          <validation>
            <converter>date</converter>
            <converter-properties>
              <property>
                <name>default-pattern</name>
                <value>MM</value>
              </property>
            </converter-properties>
          </validation>
        </fragment-container>
        
        <fragment-container>
          <name>dia</name>
          <label>Dia</label>
          <type>text</type>
          <size>25</size>
          <input-size>2</input-size>
          <validation>
            <converter>date</converter>
            <converter-properties>
              <property>
                <name>default-pattern</name>
                <value>dd</value>
              </property>
            </converter-properties>
          </validation>
        </fragment-container>
      </composite-container>
    </search-param>
  </search-params>
  
  <!-- result params -->
  <result-params>
    <result-param>
      <name>nome</name>
      <search-label>Nome</search-label>
      <fields>
        <field>NOME</field> 
      </fields>
      <align>left</align>
      <width>241</width>
      <height>30</height>
      <properties>
        <property>
          <name>field-type</name>
          <value>string-field</value>
        </property>
      </properties>
    </result-param>
    
    <composite-result-param>
      <name>composite</name>
      <search-label>Empregado</search-label>
      <height>15</height>
      
      <result-param>
        <name>numEmpregado</name>
        <search-label>Num</search-label>
        <fields>
          <field>NUM_EMPREGADO</field> 
        </fields>
        <align>center</align>
        <width>60</width>
        <height>15</height>
        <formatter>
          <null-value>-</null-value>
        </formatter>
      </result-param>
      
      <result-param>
        <name>tipoUtilizador</name>
        <search-label>Tipo</search-label>
        <fields>
          <field>TIPO</field> 
        </fields>
        <align>center</align>
        <width>60</width>
        <height>15</height>
      </result-param>
    </composite-result-param>
    
    <result-param>
      <name>data</name>
      <search-label>Data</search-label>
      <fields>
        <field>DATA</field> 
      </fields>
      <align>center</align>
      <width>60</width>
      <height>30</height>
      <formatter>
        <name>customDate</name>
        <pattern>yyyy-MM-dd</pattern>
      </formatter>
    </result-param>
  </result-params>
  
  <!-- required result params -->
  <required-result-params>
    <required-result-param>
      <name>id</name>
      <fields>
        <field>ID</field>
      </fields>
    </required-result-param>
  </required-result-params>
  
  <!-- selected result params order -->
  <selected-result-params-order>
    <selected-result-param-order>
      <name>numEmpregado</name>
      <order-type>asc</order-type>
    </selected-result-param-order>
  </selected-result-params-order>
  
</search-metadata>